,Locality,Lat,Lng,No_of_Restaurant,Cusines,Agg_Rating,Comments,No_of_Votes,Cluster Labels,1st Most Common Venue,2nd Most Common Venue,3rd Most Common Venue,4th Most Common Venue,5th Most Common Venue,6th Most Common Venue,7th Most Common Venue,8th Most Common Venue,9th Most Common Venue,10th Most Common Venue
4,"Aggarwal City Mall, Pitampura",28.690019593333332,77.13465013,3,"North Indian, Chinese, Street Food, Mithai, North Indian, Chinese",3.0333333333333337,Average,126,4,Pizza Place,Department Store,Bed & Breakfast,Chinese Restaurant,Food & Drink Shop,Gastropub,Garden Center,Garden,Gaming Cafe,Furniture / Home Store
5,"Aggarwal City Plaza, Rohini",28.700515740000004,77.11756804000001,5,"Street Food, South Indian, Mithai, North Indian, Chinese, Italian, Pizza, Fast Food, Bakery, Fast Food, North Indian, Fast Food",3.04,"Average, Good, Poor",594,4,Pizza Place,Multiplex,Electronics Store,Gym / Fitness Center,Fast Food Restaurant,Sandwich Place,Food & Drink Shop,Garden,Gaming Cafe,Furniture / Home Store
11,"Ansal Plaza Mall, Khel Gaon Marg",28.56257998375,77.22443661874999,8,"Fast Food, Burger, Italian, Pizza, Fast Food, Continental, Asian, North Indian, Japanese, Korean, Continental, Malaysian, Indonesian, Japanese, Asian, Continental, North Indian, Mughlai, Italian",3.75,"Average, Good, Very Good",875,4,Market,Karaoke Bar,Fast Food Restaurant,Malay Restaurant,Food,Gastropub,Garden Center,Garden,Gaming Cafe,Furniture / Home Store
14,Ashok Vihar Phase 2,28.693969407142855,77.17824539285714,14,"Street Food, Chinese, North Indian, Mithai, Italian, Pizza, Fast Food, South Indian, North Indian, Chinese, North Indian, Chinese, North Indian, Chinese, North Indian, Chinese, Fast Food, Chinese, Italian, North Indian, Mithai, Street Food, North Indian, Chinese, North Indian, Mughlai, Chinese, Continental, North Indian, Street Food, North Indian, Mughlai, Chinese, Italian, North Indian, Chinese",3.3785714285714286,"Average, Good",2343,4,Pizza Place,Indian Restaurant,South Indian Restaurant,Sandwich Place,Coffee Shop,Asian Restaurant,Food,Garden,Gaming Cafe,Furniture / Home Store
15,Ashok Vihar Phase 3,28.691136080909097,77.17748389272728,11,"North Indian, North Indian, Mughlai, Bakery, Pizza, Fast Food, Pizza, Fast Food, Chinese, North Indian, Mughlai, Bakery, Mughlai, North Indian, North Indian, South Indian, Street Food, North Indian, Mughlai, Fast Food, Italian, Chinese",3.3909090909090907,"Average, Good, Very Good",485,4,Gym / Fitness Center,Pizza Place,Garden,South Indian Restaurant,Gastropub,Gaming Cafe,Furniture / Home Store,Frozen Yogurt Shop,Fried Chicken Joint,French Restaurant
18,"Bellagio, Ashok Vihar Phase 2",28.696302066666664,77.17996503333335,3,"Italian, Continental, Chinese, North Indian, Mughlai",3.3000000000000003,"Average, Good",415,4,Pizza Place,Indian Restaurant,South Indian Restaurant,Sandwich Place,Coffee Shop,Asian Restaurant,Food,Garden,Gaming Cafe,Furniture / Home Store
22,Chander Nagar,28.654104528571427,77.28086602857142,7,"North Indian, North Indian, Pizza, Fast Food, Bakery, South Indian, Chinese, Fast Food, North Indian, South Indian, Chinese, North Indian",3.085714285714286,Average,80,4,Pizza Place,Gym,Fast Food Restaurant,Food,Garden Center,Garden,Gaming Cafe,Furniture / Home Store,Frozen Yogurt Shop,Fried Chicken Joint
24,Chawri Bazar,28.64965819166667,77.22843326666667,12,"Desserts, Street Food, Ice Cream, Street Food, Ice Cream, North Indian, Street Food, Mithai, Mithai, North Indian, Street Food, Beverages, Fast Food, Street Food, Fast Food, Beverages, Mithai, Street Food",3.8000000000000007,"Average, Excellent, Good, Very Good",1410,4,Snack Place,Indian Restaurant,Paper / Office Supplies Store,Light Rail Station,Hardware Store,Fast Food Restaurant,Food & Drink Shop,Garden Center,Garden,Gaming Cafe
36,"D Mall, Netaji Subhash Place",28.692546420000003,77.15257562000001,5,"North Indian, Chinese, Continental, Fast Food, Burger, North Indian, Chinese, Finger Food, North Indian, South Indian, Chinese, Street Food, Fast Food, Mithai, Desserts, North Indian",3.4799999999999995,"Average, Good",948,4,Fast Food Restaurant,Indian Restaurant,Coffee Shop,Shopping Mall,Multiplex,Asian Restaurant,Arts & Crafts Store,Sandwich Place,Snack Place,Diner
50,East Patel Nagar,28.645084153250004,77.173360176,40,"Bakery, North Indian, Chinese, South Indian, Cafe, Ice Cream, Fast Food, North Indian, North Indian, Mughlai, Chinese, Seafood, Fast Food, Cafe, Fast Food, Cafe, Chinese, North Indian, Mughlai, Chinese, Desserts, Bakery, Desserts, Raw Meats, Fast Food, Cafe, North Indian, Mughlai, Continental, Raw Meats, North Indian, Fast Food, North Indian, North Indian, Mughlai, Chinese, Beverages, Raw Meats, Fast Food, North Indian, Chinese, Cafe, Fast Food, North Indian, North Indian, Chinese, Mughlai, Continental, Chinese, North Indian, Healthy Food, Fast Food, North Indian, Chinese, Fast Food, Pizza, Fast Food, Burger, Desserts, Fast Food, South Indian, North Indian, Chinese, Seafood, Continental, Healthy Food, Chinese, Fast Food, Chinese, Thai, Seafood, North Indian, Fast Food, Mughlai, Healthy Food, Fast Food, Fast Food, Burger, Bakery, Fast Food",3.2350000000000003,"Average, Good, Poor, Very Good",2578,4,Pizza Place,Metro Station,Hotel,Bar,Bed & Breakfast,Chinese Restaurant,Convenience Store,Liquor Store,Coffee Shop,Fast Food Restaurant
51,East of Kailash,28.55716622,77.25032946559999,25,"Mithai, North Indian, Mughlai, Chinese, Street Food, South Indian, Mithai, Cafe, North Indian, Chinese, South Indian, North Indian, Chinese, Bakery, Fast Food, Chinese, Bakery, Biryani, Mughlai, North Indian, North Indian, Italian, Chinese, Fast Food, Bakery, Desserts, Bihari, North Indian, Mughlai, Chinese, North Indian, North Indian, Mughlai, North Indian, South Indian, Raw Meats, Fast Food, North Indian, North Indian, Mughlai, Chinese, Maharashtrian, Chinese, Mughlai, North Indian, Chinese, Thai, Asian, Malaysian, Vietnamese, Japanese",3.08,"Average, Very Good",1120,4,Indie Movie Theater,Hotel,Fast Food Restaurant,Coffee Shop,Hot Dog Joint,Temple,Vegetarian / Vegan Restaurant,Dumpling Restaurant,Food,Garden
52,"Epicuria Food Mall, Nehru Place",28.551417049999998,77.25165314499999,20,"Cafe, Pizza, Desserts, Ice Cream, Juices, Mughlai, North Indian, North Indian, Mughlai, Chinese, South Indian, Chinese, Cafe, Tea, Chinese, Thai, Asian, Beverages, North Indian, Mughlai, North Indian, Street Food, American, Fast Food, Salad, Healthy Food, Fast Food, European, Italian, North Indian, European, Chinese, North Indian, Italian, Finger Food, Italian, North Indian, Italian, Mediterranean, Continental, North Indian",3.5050000000000003,"Average, Good, Very Good",7446,4,Indian Restaurant,Fast Food Restaurant,Coffee Shop,Pizza Place,Chinese Restaurant,Bengali Restaurant,Park,Gastropub,Frozen Yogurt Shop,Sandwich Place
53,"Eros Hotel, Nehru Place",28.549855759999996,77.2495855,5,"Cafe, Continental, North Indian, Italian, Finger Food, Bakery, Fast Food, Chinese",3.7199999999999998,"Average, Good, Very Good",352,4,Fast Food Restaurant,Coffee Shop,Pizza Place,Restaurant,Bengali Restaurant,Gastropub,Frozen Yogurt Shop,Sandwich Place,Chinese Restaurant,Food
57,GTB Nagar,28.69983730117647,77.19929352941175,17,"Mithai, Street Food, Fast Food, Cafe, Beverages, North Indian, Fast Food, North Indian, Chinese, Continental, Italian, North Indian, Chinese, North Indian, Raw Meats, Fast Food, North Indian, Raw Meats, Fast Food, Fast Food, North Indian, Cafe, Chinese, Italian, Healthy Food, Juices, Salad, North Indian, Continental, Italian, North Indian, Mughlai, Chinese, North Indian, Chinese, Continental, Italian, Cafe, Fast Food, Italian",3.3764705882352937,"Average, Good, Very Good",2460,4,Pizza Place,Juice Bar,Food Truck,Flea Market,Garden Center,Garden,Gaming Cafe,Furniture / Home Store,Frozen Yogurt Shop,Fried Chicken Joint
73,"Hotel Regent Grand, Karol Bagh",28.643036499999997,77.1729864,1,Cafe,3.0,Average,7,4,Pizza Place,Metro Station,Fast Food Restaurant,Coffee Shop,Bar,Bed & Breakfast,Liquor Store,Hotel,Convenience Store,Café
87,Jangpura,28.582031094285718,77.24576117142858,35,"Mithai, Street Food, North Indian, Bakery, North Indian, North Indian, Chinese, Chinese, Chinese, Fast Food, North Indian, Mughlai, Chinese, Ice Cream, Desserts, Raw Meats, North Indian, Fast Food, Mughlai, Afghani, Street Food, Mithai, Mithai, Street Food, Fast Food, Burger, Bakery, Fast Food, North Indian, Mughlai, North Indian, Chinese, Fast Food, North Indian, Mughlai, South Indian, North Indian, Afghani, Bakery, Desserts, Fast Food, North Indian, Raw Meats, Fast Food, Fast Food, North Indian, Chinese, American, Fast Food, Salad, Healthy Food, North Indian, Chinese, Biryani, North Indian, Mughlai, Pizza, Fast Food, Bakery, Fast Food, North Indian, Chinese, Healthy Food, Continental, North Indian, Mughlai, North Indian, Chinese, Fast Food",3.1171428571428574,"Average, Good, Poor, Very Good",2140,4,Sandwich Place,Chinese Restaurant,Indie Movie Theater,Fast Food Restaurant,Flea Market,BBQ Joint,Women's Store,Garden Center,Garden,Gaming Cafe
90,"Jaypee Siddharth, Rajendra Place",28.64275465,77.17587094999999,2,"North Indian, European, Continental, North Indian",3.45,"Average, Good",322,4,Fast Food Restaurant,Pizza Place,Smoke Shop,Liquor Store,Convenience Store,Coffee Shop,Café,Breakfast Spot,Bed & Breakfast,Bar
94,Kalkaji,28.538152963142856,77.25566936085718,70,"Bakery, Desserts, Mithai, Street Food, North Indian, South Indian, Chinese, Mithai, Mithai, Street Food, Mithai, North Indian, South Indian, Street Food, Mithai, Street Food, South Indian, Chinese, North Indian, Mithai, Street Food, Cafe, Bakery, Desserts, Fast Food, Street Food, North Indian, Chinese, North Indian, Fast Food, North Indian, Fast Food, Bakery, Desserts, Ice Cream, Desserts, Ice Cream, Desserts, Raw Meats, North Indian, Fast Food, North Indian, Mughlai, Chinese, North Indian, Mughlai, Chinese, Fast Food, North Indian, Beverages, North Indian, South Indian, North Indian, Fast Food, North Indian, Biryani, Mughlai, Biryani, North Indian, Desserts, Ice Cream, North Indian, Mughlai, Chinese, Bakery, Desserts, North Indian, Mughlai, Thai, Chinese, Seafood, North Indian, Street Food, North Indian, South Indian, North Indian, Fast Food, Mughlai, Street Food, South Indian, Chinese, Fast Food, North Indian, Mughlai, North Indian, Chinese, North Indian, Street Food, North Indian, Biryani, Fast Food, Chinese, North Indian, North Indian, Mughlai, Fast Food, Biryani, Chinese, Thai, Fast Food, Italian, North Indian, Chinese, North Indian, Cafe, North Indian, Lebanese, Continental, Italian, Chinese, Continental, Thai, Mediterranean, Lebanese, Ice Cream, Desserts, Ice Cream, Desserts, North Indian, Street Food, Pizza, Fast Food, Street Food, North Indian, Mughlai, Chinese, South Indian, North Indian, Street Food, North Indian, Mithai, North Indian, Chinese, North Indian, North Indian, Chinese, Bakery, Fast Food",3.117142857142857,"Average, Good, Poor",3642,4,Fast Food Restaurant,Market,Park,Fried Chicken Joint,Sandwich Place,Food Truck,Bank,Pizza Place,Indian Restaurant,Dessert Shop
95,Kamla Nagar,28.6811542848276,77.20330991431035,58,"Fast Food, North Indian, Chinese, Cafe, North Indian, Chinese, South Indian, Mughlai, North Indian, Cafe, Fast Food, Desserts, Pizza, Fast Food, North Indian, Fast Food, Chinese, Continental, Cafe, Ice Cream, Desserts, North Indian, Mughlai, South Indian, North Indian, Chinese, Fast Food, Beverages, Chinese, North Indian, Italian, Continental, Fast Food, North Indian, Chinese, Continental, North Indian, South Indian, North Indian, Chinese, South Indian, Cafe, Chinese, Continental, Italian, Desserts, Beverages, North Indian, Chinese, Italian, Fast Food, Fast Food, North Indian, South Indian, North Indian, North Indian, North Indian, Beverages, Desserts, Beverages, Fast Food, Beverages, Fast Food, North Indian, Biryani, North Indian, Mughlai, Ice Cream, Fast Food, Beverages, Ice Cream, Desserts, Ice Cream, Beverages, Mithai, Chinese, Street Food, Bakery, Chinese, Fast Food, Street Food, Street Food, North Indian, Chinese, Thai, Bakery, Fast Food, Beverages, Fast Food, Street Food, Fast Food, South Indian, North Indian, Chinese, Mithai, Street Food, North Indian, Chinese, American, Fast Food, Salad, Healthy Food, Bakery, Desserts, North Indian, Biryani, Chinese, Fast Food, Chinese, North Indian, Italian, Fast Food, Street Food, North Indian, North Indian, Chinese, Bakery, North Indian, Italian, Chinese, Fast Food",3.453448275862068,"Average, Good, Very Good",5267,4,Fast Food Restaurant,Breakfast Spot,Coffee Shop,Indian Restaurant,Chinese Restaurant,Donut Shop,Café,Bank,Miscellaneous Shop,Clothing Store
98,Karkardooma,28.651526717272723,77.30352050954544,22,"Mughlai, Fast Food, North Indian, Chinese, Raw Meats, North Indian, Fast Food, North Indian, South Indian, Chinese, North Indian, Mughlai, Chinese, North Indian, Mughlai, North Indian, Chinese, Italian, North Indian, Mughlai, Chinese, Continental, North Indian, Mediterranean, Continental, North Indian, Mughlai, Chinese, Cafe, Italian, Chinese, North Indian, North Indian, South Indian, North Indian, Chinese, Street Food, Mithai, North Indian, Mughlai, Continental, Chinese, North Indian, Mughlai, Chinese, Street Food, North Indian, North Indian, Chinese, Continental, Fast Food, North Indian, Chinese, Desserts, Fast Food, Ice Cream, Ice Cream, Desserts",3.4909090909090907,"Average, Good, Very Good",3222,4,Pizza Place,Plaza,Train Station,Food Truck,Flea Market,Garden Center,Garden,Gaming Cafe,Furniture / Home Store,Frozen Yogurt Shop
101,Kashmiri Gate,28.667644199999998,77.22933370000001,1,"Fast Food, Burger",3.3,Average,132,4,Metro Station,Pizza Place,Bus Station,American Restaurant,Fast Food Restaurant,Historic Site,Women's Store,Garden,Gaming Cafe,Furniture / Home Store
103,Kirti Nagar,28.652500932545458,77.1371538449091,55,"North Indian, Chinese, North Indian, Mithai, North Indian, South Indian, Chinese, Bakery, North Indian, Chinese, Street Food, South Indian, Mithai, North Indian, Mughlai, Chinese, Cafe, Fast Food, Chinese, North Indian, Chinese, Fast Food, North Indian, Chinese, Continental, Mithai, Street Food, North Indian, Chinese, Italian, Fast Food, North Indian, Mughlai, Chinese, Cafe, Continental, Pizza, Fast Food, North Indian, Chinese, Biryani, Mughlai, Chinese, North Indian, Mughlai, Chinese, Raw Meats, North Indian, Fast Food, North Indian, Chinese, Continental, North Indian, North Indian, Chinese, Fast Food, Bakery, North Indian, Mughlai, Chinese, Italian, Fast Food, Lucknowi, Biryani, Desserts, Bakery, Fast Food, Raw Meats, Fast Food, North Indian, North Indian, Italian, Pizza, Fast Food, Fast Food, Chinese, Bakery, Mughlai, North Indian, Chinese, North Indian, Chinese, Mughlai, Chinese, Mughlai, Street Food, North Indian, Chinese, Chinese, South Indian, North Indian, Italian, Continental, North Indian, Chinese, Fast Food, Hyderabadi, North Indian, North Indian, Chinese, Mughlai, Continental, North Indian, Mughlai, Chinese, Street Food, North Indian, Mughlai, North Indian, Chinese, Continental, Italian, Street Food, North Indian, Chinese, North Indian, Chinese, Chinese, Fast Food, North Indian, Chinese",3.0799999999999996,"Average, Good, Poor",2196,4,Pizza Place,Spa,Convenience Store,Fish & Chips Shop,Food,Garden Center,Garden,Gaming Cafe,Furniture / Home Store,Frozen Yogurt Shop
104,Krishna Nagar,28.65626338214285,77.27901716785715,42,"North Indian, North Indian, North Indian, Chinese, Mughlai, Chinese, North Indian, North Indian, Chinese, Street Food, North Indian, Fast Food, South Indian, Desserts, Street Food, North Indian, Chinese, Mughlai, North Indian, Chinese, South Indian, Pizza, Fast Food, Pizza, Fast Food, Bakery, Fast Food, North Indian, Chinese, Ice Cream, Desserts, Mithai, North Indian, Healthy Food, North Indian, Desserts, North Indian, North Indian, North Indian, South Indian, North Indian, South Indian, Fast Food, Mithai, North Indian, North Indian, North Indian, Fast Food, Street Food, North Indian, Chinese, North Indian, South Indian, North Indian, Chinese, North Indian, North Indian, Mughlai, South Indian, Fast Food, Street Food, North Indian, Mughlai, Chinese, North Indian, Chinese, Fast Food, North Indian, South Indian, Chinese, Fast Food, North Indian, Chinese, Pizza, Fast Food",3.097619047619047,"Average, Good",965,4,Pizza Place,Park,Fast Food Restaurant,Food,Garden Center,Garden,Gaming Cafe,Furniture / Home Store,Frozen Yogurt Shop,Fried Chicken Joint
106,Lajpat Nagar 1,28.57552459842105,77.24169899526316,19,"Fast Food, Cafe, Chinese, Street Food, Chinese, Fast Food, Mithai, North Indian, Chinese, Street Food, North Indian, Chinese, Chinese, Fast Food, Fast Food, Bakery, Desserts, North Indian, Chinese, North Indian, North Indian, Chinese, Fast Food, Desserts, Ice Cream, South Indian, North Indian, North Indian, Chinese, Fast Food, North Indian, Street Food, Chinese, Asian, Thai, North Indian, North Indian, Mughlai",3.1263157894736846,"Average, Good",998,4,Market,Cosmetics Shop,Coffee Shop,Asian Restaurant,Flea Market,Fast Food Restaurant,Arcade,Neighborhood,Indian Restaurant,Cocktail Bar
107,Lajpat Nagar 2,28.569394142857142,77.24226306190474,21,"North Indian, Chinese, Street Food, Mithai, Biryani, Biryani, Hyderabadi, Burger, Fast Food, Pizza, Fast Food, North Indian, Mughlai, Afghani, Mughlai, North Indian, Italian, Pizza, Fast Food, North Indian, Street Food, North Indian, South Indian, Chinese, North Indian, Chinese, Mithai, North Indian, South Indian, Chinese, Street Food, Burger, Fast Food, Chinese, Bakery, Bakery, North Indian, South Indian, Fast Food, Street Food, Chinese, Beverages, Desserts, Mithai, North Indian, South Indian, Chinese, Street Food, Fast Food, Mithai, Desserts, Desserts, Asian, Thai, North Indian, South Indian, Chinese, Cafe",3.2523809523809524,"Average, Good",1525,4,Pizza Place,Market,Fast Food Restaurant,Donut Shop,Indian Restaurant,Café,Sporting Goods Shop,Movie Theater,Neighborhood,Coffee Shop
130,"Metro Walk Mall, Rohini",28.7241003,77.11365373333335,3,"Fast Food, Burger, North Indian, Mughlai, Chinese, Italian, Pizza, Fast Food",3.133333333333333,Average,325,4,Pizza Place,Theme Park,Asian Restaurant,Fast Food Restaurant,Shopping Mall,Donut Shop,Dumpling Restaurant,Garden Center,Garden,Gaming Cafe
132,Model Town 2,28.706295056,77.190583248,25,"Fast Food, Fast Food, Beverages, Mithai, Pizza, Fast Food, Ice Cream, Desserts, North Indian, Chinese, Fast Food, North Indian, Mughlai, Chinese, Salad, Healthy Food, Burger, Italian, Continental, Chinese, North Indian, Beverages, Chinese, Chinese, North Indian, Mughlai, Chinese, Beverages, Mithai, South Indian, North Indian, Chinese, Fast Food, Street Food, American, Fast Food, Salad, Healthy Food, Chinese, Street Food, Desserts, North Indian, Fast Food, Street Food, Bakery, Fast Food, Burger, Pizza, Bakery, Fast Food, North Indian, Chinese, Continental, Italian",3.256,"Average, Good, Very Good",1717,4,Pizza Place,Donut Shop,Ice Cream Shop,Frozen Yogurt Shop,Coffee Shop,Fast Food Restaurant,Food,Garden Center,Garden,Gaming Cafe
136,Moti Nagar,28.658244285000002,77.14090729,20,"North Indian, North Indian, Fast Food, Fast Food, Burger, Chinese, North Indian, Street Food, North Indian, Mughlai, Ice Cream, North Indian, Mughlai, Bakery, Fast Food, North Indian, North Indian, Mughlai, Fast Food, North Indian, Chinese, Fast Food, Bakery, Desserts, North Indian, Fast Food, Street Food, North Indian, Chinese, Fast Food, Ice Cream, Seafood, North Indian, South Indian",3.2399999999999998,"Average, Good",567,4,Metro Station,Fried Chicken Joint,Fast Food Restaurant,Flea Market,Women's Store,Gastropub,Garden Center,Garden,Gaming Cafe,Furniture / Home Store
138,Munirka,28.556145049999998,77.17273141818183,22,"Biryani, North Indian, Fast Food, Street Food, Chinese, Raw Meats, North Indian, Fast Food, Chinese, Fast Food, North Eastern, North Indian, Chinese, North Indian, North Indian, Mughlai, Chinese, Mithai, Street Food, Cafe, Fast Food, Pizza, Fast Food, North Indian, Mughlai, Chinese, South Indian, North Indian, Fast Food, American, Fast Food, Salad, Healthy Food, Chinese, North Indian, Chinese, Chinese, Thai, Chinese, North Indian, Bakery, Desserts, North Indian, Chinese",3.0409090909090906,"Average, Good, Poor",637,4,Playground,Bakery,Department Store,Sandwich Place,Pharmacy,Pizza Place,Indian Restaurant,Hyderabadi Restaurant,Falafel Restaurant,Fried Chicken Joint
141,Nehru Place,28.549168615999992,77.25165987199999,25,"North Indian, Mughlai, American, Tex-Mex, Italian, Mexican, North Indian, North Indian, Mithai, North Indian, Street Food, Chinese, South Indian, Indian, Cafe, Cafe, Ice Cream, Beverages, Fast Food, Pizza, Fast Food, North Indian, Street Food, North Indian, North Indian, Street Food, Fast Food, North Indian, South Indian, Chinese, North Indian, Chinese, North Indian, South Indian, Fast Food, South Indian, North Indian, Chinese, Finger Food, Italian, Middle Eastern, Fast Food, Burger, North Indian, Italian, Pizza, Fast Food, South Indian, North Indian, Chinese, American, Fast Food, Salad, Healthy Food, North Indian, Mughlai, Bengali, Seafood",3.196,"Average, Good, Poor, Very Good",2715,4,Indian Restaurant,Fast Food Restaurant,Coffee Shop,Pizza Place,Chinese Restaurant,Bengali Restaurant,Park,Gastropub,Frozen Yogurt Shop,Sandwich Place
142,Netaji Subhash Place,28.693269644680857,77.15037760425531,47,"Finger Food, North Indian, North Indian, South Indian, Fast Food, Street Food, Chinese, Beverages, Desserts, Mithai, Cafe, Fast Food, Italian, Pizza, Desserts, North Indian, Fast Food, South Indian, Chinese, Pizza, Fast Food, North Indian, Mughlai, Fast Food, Beverages, North Indian, South Indian, Fast Food, Burger, Fast Food, North Indian, Mughlai, Italian, Pizza, Fast Food, North Indian, Fast Food, Chinese, Fast Food, North Indian, Chinese, Cafe, Chinese, American, Fast Food, Salad, Healthy Food, North Indian, Italian, Chinese, Thai, Fast Food, Chinese, Street Food, Burger, Fast Food, Cafe, Fast Food, Chinese, Fast Food, Ice Cream, Desserts, Fast Food, North Indian, Beverages, Fast Food, Burger, Chinese, Desserts, Beverages, North Indian, Chinese, Chinese, Fast Food, North Indian, Chinese, Street Food, Fast Food, Beverages, Fast Food, Beverages, Cafe, Cafe, North Indian, Bakery, North Indian, Chinese, North Indian, Chinese, Continental, Cafe, Tea, North Indian, Chinese, Italian, Mexican, Lebanese, North Indian, Chinese, Italian, Lebanese, Mexican",3.5191489361702115,"Average, Good, Very Good",7642,4,Fast Food Restaurant,Indian Restaurant,Coffee Shop,Shopping Mall,Multiplex,Asian Restaurant,Arts & Crafts Store,Sandwich Place,Snack Place,Diner
155,Paschim Vihar,28.669159867499996,77.0990075092857,56,"Fast Food, Pizza, Fast Food, Chinese, North Indian, Bakery, Fast Food, Cafe, Bakery, North Indian, Mughlai, Chinese, Ice Cream, Desserts, Bakery, Chinese, Fast Food, Pizza, Pizza, Fast Food, Raw Meats, North Indian, Fast Food, Fast Food, Italian, Pizza, Mithai, Street Food, Chinese, Thai, Fast Food, North Indian, North Indian, North Indian, North Indian, Chinese, Fast Food, Fast Food, Burger, South Indian, South Indian, Fast Food, North Indian, Pizza, Fast Food, Italian, Pizza, Fast Food, Fast Food, Bakery, Desserts, Fast Food, North Indian, South Indian, Chinese, North Indian, Chinese, Desserts, Fast Food, Chinese, North Indian, Chinese, Street Food, North Indian, Mughlai, South Indian, Chinese, South Indian, Chinese, South Indian, North Indian, Chinese, Chinese, Chinese, Fast Food, North Indian, Chinese, Fast Food, Mughlai, Biryani, North Indian, North Indian, Fast Food, Street Food, North Indian, Mughlai, North Indian, Mughlai, North Indian, Street Food, Fast Food, Bakery, Fast Food, North Indian, Chinese, Fast Food, Biryani, North Indian, Chinese, Fast Food, North Indian, Chinese, Mughlai, American, Fast Food, Salad, Healthy Food",3.148214285714286,"Average, Good, Poor",2735,4,Pizza Place,Coffee Shop,Sandwich Place,Chinese Restaurant,Garden,Market,Multicuisine Indian Restaurant,Indian Restaurant,Discount Store,Gaming Cafe
157,"Piccadily Hotel, Janakpuri",28.6295053,77.079438,1,"North Indian, Kashmiri, Mughlai",2.6,Average,67,4,Indian Restaurant,Fast Food Restaurant,Sandwich Place,Chinese Restaurant,Hotel,Pizza Place,BBQ Joint,Business Center,Music Store,Coffee Shop
